[
    {
        "identifier": 1,
        "alg": "com.digimarc.validate.1",
        "type": "watermark",
        "decodedMediaTypes": [
            "audio",
            "video",
            "text",
            "image"
        ],
        "entryMetadata": {
            "description": "Digimarc Validate Digital Watermarking algorithm",
            "dateEntered": "2024-05-17T17:00:00.000Z",
            "contact": "info@digimarc.com",
            "informationalUrl": "https://www.digimarc.com/products/digital-content-authentication"
        }
    },
    {
        "identifier": 2,
        "alg": "org.atsc.a336",
        "type": "watermark",
        "decodedMediaTypes": [
            "audio",
            "video",
            "image"
        ],
        "entryMetadata": {
            "description": "ATSC watermarking (A/334, A/335, A/336)",
            "dateEntered": "2024-05-17T15:43:00.000Z",
            "contact": "atsc@atsc.org",
            "informationalUrl": "https://www.atsc.org/atsc-documents/a3362017-content-recovery-redistribution-scenarios/"
        }
    },
    {
        "identifier": 3,
        "alg": "io.iscc.v0",
        "type": "fingerprint",
        "decodedMediaTypes": [
            "text",
            "image",
            "audio",
            "video",
            "application"
        ],
        "entryMetadata": {
            "description": "ISO 24138 - International Standard Content Code (ISCC) V0 algorithm",
            "dateEntered": "2024-05-17T16:00:00Z",
            "contact": "info@iscc.io",
            "informationalUrl": "https://ieps.iscc.codes/iep-0020/"
        }
    },
    {
        "identifier": 4,
        "alg": "com.adobe.trustmark.Q",
        "type": "watermark",
        "decodedMediaTypes": [
            "image"
        ],
        "entryMetadata": {
            "description": "Adobe Trustmark variant Q",
            "dateEntered": "2024-05-17T17:00:00.000Z",
            "contact": "collomos@adobe.com",
            "informationalUrl": "https://github.com/adobe/trustmark/"
        }
    },
    {
        "identifier": 5,
        "alg": "com.adobe.trustmark.C",
        "type": "watermark",
        "decodedMediaTypes": [
            "image"
        ],
        "entryMetadata": {
            "description": "Adobe Trustmark variant C",
            "dateEntered": "2024-05-17T17:00:00.000Z",
            "contact": "collomos@adobe.com",
            "informationalUrl": "https://github.com/adobe/trustmark/"
        }
    },
    {
        "identifier": 6,
        "alg": "com.adobe.icn.dense",
        "type": "fingerprint",
        "decodedMediaTypes": [
            "image"
        ],
        "entryMetadata": {
            "description": "Adobe Image Comparator Network Dense Fingerprint",
            "dateEntered": "2024-05-17T17:00:00.000Z",
            "contact": "collomos@adobe.com",
            "informationalUrl": "https://openaccess.thecvf.com/content/CVPR2021W/WMF/html/Black_Deep_Image_Comparator_Learning_To_Visualize_Editorial_Change_CVPRW_2021_paper.html"
        }
    },
    {
        "identifier": 7,
        "alg": "ai.steg.api",
        "type": "watermark",
        "decodedMediaTypes": [
            "image",
            "video",
            "application"
        ],
        "entryMetadata": {
            "description": "Steg.AI invisible watermarking",
            "dateEntered": "2024-05-20T10:50:00.000Z",
            "contact": "info@steg.ai",
            "informationalUrl": "https://openaccess.thecvf.com/content_CVPR_2019/papers/Wengrowski_Light_Field_Messaging_With_Deep_Photographic_Steganography_CVPR_2019_paper.pdf"
        }
    },
    {
        "identifier": 8,
        "alg": "ai.trufo.pawprint.watermark",
        "type": "watermark",
        "decodedMediaTypes": [
            "image",
            "audio",
            "video"
        ],
        "entryMetadata": {
            "description": "PawPrint neural watermarking for images, audio, and video. Imperceptible, with a 44/88 bit payload robust to compression, cropping, rotation, splicing, time/space scaling, common filters, and moderate AI transformations.",
            "dateEntered": "2024-08-14T15:00:00.000Z",
            "contact": "support@trufo.ai",
            "informationalUrl": "https://trufo.ai/watermarks"
        },
        "softBindingResolutionApis": [
            "https://c2pa.trufo.ai/v1"
        ]
    },
    {
        "identifier": 9,
        "alg": "ai.trufo.pawprint.fingerprint",
        "type": "fingerprint",
        "decodedMediaTypes": [
            "image",
            "audio",
            "video"
        ],
        "entryMetadata": {
            "description": "PawPrint neural fingerprinting for images, audio, and video. Generates a perceptual content signature that can be registered in or queried against Trufo's federated provenance ledgers for content matching and attribution.",
            "dateEntered": "2024-08-14T15:00:00.000Z",
            "contact": "support@trufo.ai",
            "informationalUrl": "https://trufo.ai/watermarks"
        },
        "softBindingResolutionApis": [
            "https://c2pa.trufo.ai/v1"
        ]
    },
    {
        "identifier": 10,
        "alg": "app.overlai.watermark.1",
        "type": "watermark",
        "decodedMediaTypes": [
            "image"
        ],
        "entryMetadata": {
            "description": "Overlai Watermark version 1",
            "dateEntered": "2024-08-14T16:00:00.000Z",
            "contact": "luke@overlai.app",
            "informationalUrl": "https://overlai.app/watermark"
        }
    },
    {
        "identifier": 11,
        "alg": "tv.kinetiq.watercast.48.1",
        "type": "watermark",
        "decodedMediaTypes": [
            "video"
        ],
        "entryMetadata": {
            "description": "Teletrax Watermarking algorithm",
            "dateEntered": "2024-10-16T17:00:00.000Z",
            "contact": "c2pa@kinetiq.tv",
            "informationalUrl": "https://kinetiq.tv/broadcasting-syndication/"
        }
    },
    {
        "identifier": 12,
        "alg": "castLabs.watermark.1",
        "type": "watermark",
        "decodedMediaTypes": [
            "video",
            "image",
            "audio"
        ],
        "entryMetadata": {
            "description": "castLabs Single Frame Forensic Watermarking",
            "dateEntered": "2024-11-13T12:00:00.000Z",
            "contact": "info@castlabs.com",
            "informationalUrl": "https://castlabs.com/image-watermarking/"
        }
    },
    {
        "identifier": 13,
        "alg": "com.adobe.trustmark.P",
        "type": "watermark",
        "decodedMediaTypes": [
            "image"
        ],
        "entryMetadata": {
            "description": "Adobe Trustmark variant P",
            "dateEntered": "2025-02-05T17:00:00.000Z",
            "contact": "collomos@adobe.com",
            "informationalUrl": "https://github.com/adobe/trustmark/"
        }
    },
    {
        "identifier": 14,
        "alg": "com.imatag.lamark.v1",
        "type": "watermark",
        "decodedMediaTypes": [
            "image"
        ],
        "entryMetadata": {
            "description": "Imatag invisible watermarking for images",
            "dateEntered": "2025-02-26T15:00:00.000Z",
            "contact": "c2pa@imatag.com",
            "informationalUrl": "https://www.imatag.com/digital-watermarking/"
        }
    },
    {
        "identifier": 15,
        "alg": "com.nagra.nexguard.watermark.1",
        "type": "watermark",
        "decodedMediaTypes": [
            "video",
            "audio",
            "image"
        ],
        "entryMetadata": {
            "description": "NAGRA NexGuard Watermarking with Single Frame Detection Capability",
            "dateEntered": "2025-02-26T13:53:25.000Z",
            "contact": "gabriel.cantin@nagra.com",
            "informationalUrl": "https://nagra.vision/security-solutions/forensic-watermarking/"
        }
    },
    {
        "identifier": 16,
        "alg": "com.mentaport.watermark.1",
        "type": "watermark",
        "decodedMediaTypes": [
            "video",
            "audio",
            "image"
        ],
        "entryMetadata": {
            "description": "Mentaport Watermarking Engine",
            "dateEntered": "2025-03-12T13:00:00.000Z",
            "contact": "hello@mentaport.com",
            "informationalUrl": "https://docs.mentaport.xyz"
        }
    },
    {
        "identifier": 17,
        "alg": "com.digicaps.fingerprint.1",
        "type": "fingerprint",
        "decodedMediaTypes": [
            "image"
        ],
        "entryMetadata": {
            "description": "DigiCAP Fingerprint Engine",
            "dateEntered": "2025-06-16T17:00:00.000Z",
            "contact": "info.bornid@digicaps.com",
            "informationalUrl": "https://docs.bornid.io"
        }
    },
    {
        "identifier": 18,
        "alg": "com.sonicorigin.watermark.1",
        "type": "watermark",
        "decodedMediaTypes": [
            "audio",
            "video"
        ],
        "entryMetadata": {
            "description": "SonicOrigin Watermarking Engine",
            "dateEntered": "2025-08-13T18:25:00.000Z",
            "contact": "info@sonicai.ai",
            "informationalUrl": "https://sonicai.ai"
        }
    },
    {
        "identifier": 19,
        "alg": "com.microsoft.invismark.1",
        "type": "watermark",
        "decodedMediaTypes": [
            "image",
            "video"
        ],
        "entryMetadata": {
            "description": "Microsoft Responsible AI InvisMark",
            "dateEntered": "2025-10-12T18:25:00.000Z",
            "contact": "rai_provenance@microsoft.com",
            "informationalUrl": "https://arxiv.org/abs/2411.07795"
        }
    },
    {
        "identifier": 20,
        "alg": "com.microsoft.wavmark.1",
        "type": "watermark",
        "decodedMediaTypes": [
            "audio",
            "video"
        ],
        "entryMetadata": {